{
  "analysis": {
    "run_date": "2026-02-18T00:00:00Z",
    "logic_name": "cmscan",
    "display_label": "cmscan",
    "description": "cmscan analysis",
    "program": "test",
    "program_version": "0.0"
  },
  "source": {
    "source_provider": "prov",
    "is_primary": true
  },
  "ncrna_tool": "cmscan",
  "ncrna_features": [
    {
      "seq_region": "chr1_chunk_start_1",
      "seq_region_start": 1,
      "seq_region_end": 3,
      "seq_region_strand": 1,
      "biotype": "miRNA",
      "score": 1.0,
      "target_name": "MIRTEST",
      "is_significant": true
    }
  ]
}
